Unnamed: 0,Unnamed: 0.1,video,frame_count,width,height,question,answer,qid,type,bigCate
17058,17058,6042635705,1475,640,480,is the baby skilled at eating,no,6,DB,25
17066,17066,4820521883,540,640,360,is the man trying to teach the kids swimming,yes,3,DB,68
17074,17074,11772124873,2670,640,360,is the lady in white enjoying her performance,yes,6,DB,23
17075,17075,6011624858,1744,640,362,is the dog wild or domesticated,domesticated,4,DB,71
17081,17081,2475104074,1197,640,480,is the boy proficient in reading,no,4,DB,27
17093,17093,4407186551,2250,640,480,did the girl tie their hair while dancing,yes,2,DB,27
17097,17097,7400171806,802,640,480,is the boy playing or drinking the water from the dispenser,playing,4,DB,68
17105,17105,5901242685,1954,640,480,is the boy in red supposed to be eating his food on the table,yes,1,DB,77
17111,17111,2730042852,876,500,375,is the man playing with the baby at the park,yes,6,DB,68
17116,17116,6296684125,732,640,360,is the place crowded or empty,crowded,9,DB,68
17136,17136,4602939266,2697,360,480,is the boy in blue playful with the pipe in this video,yes,7,DB,77
17144,17144,4405101727,795,640,480,did the man in black look frustrated when his face was squeezed,yes,3,DB,52
17200,17200,5271223888,901,640,360,are the group of people exercising or running away from something,exercising,0,DB,58
17206,17206,2844635571,2697,500,375,does the man walking pass the boys stop them from playing,no,2,DB,68
17218,17218,5964971100,989,640,360,does it look hard to balance the cards,yes,3,DB,68
17233,17233,6032430171,408,640,360,is the child able to walk freely and confidently by himself,no,0,DB,68
17235,17235,3076771705,534,640,480,is the food that the cat is eating supposed to be for it,no,10,DB,1
17270,17270,12398010263,4145,640,360,is the brown big dog angry with the small dog for touching it,no,2,DB,71
17309,17309,3696891751,1377,640,362,did the man in stripes look experienced in playing the guitar,yes,2,DB,77
17344,17344,3004725629,2697,500,375,are the children happy,yes,1,DB,68
17367,17367,3350647572,1836,640,480,did the plush toy managed to sit upright on the floor,no,8,DB,68
17371,17371,2785529380,1378,320,240,did the cats interact with one another at all while eating,no,4,DB,1
17408,17408,6896590813,2697,640,480,are the kids trying to imitate the lady,yes,1,DB,68
17416,17416,4170536877,718,640,480,is man taking good care and caressing for the dog,yes,4,DB,71
17420,17420,6446785503,2616,640,360,is the girl the only child in the room,yes,9,DB,68
17446,17446,8267897544,930,640,360,were the man and the woman performing for a large crowd,yes,0,DB,58
17448,17448,3653939911,1185,640,480,how many hamsters are there in the cage,yes,3,DB,20
17464,17464,7040233679,910,640,360,is the man in red shortsighted,yes,9,DB,44
17477,17477,3487475414,1099,640,480,is the boy enjoying his food,yes,4,DB,68
17478,17478,7748596700,304,640,352,did the boy fall down,yes,8,DB,68
17492,17492,6804020709,574,640,1138,are the pets fighting or playing with each other,fighting,1,DB,77
17509,17509,6804937976,2629,640,360,did the baby enjoy the company of the lady,yes,5,DB,38
17513,17513,3878228533,2000,640,480,is the place well lighted or dim,dim,4,DB,65
17515,17515,2755895908,2070,640,480,was the boy wearing a hat when playing with the balloon,no,9,DB,68
17531,17531,6227440287,2158,640,1138,is the boy skilled in walking,no,0,DB,27
17559,17559,2637595500,509,640,480,is the baby trying to get up the sofa when he raised his hand up to touch the sofa,yes,9,DB,77
17591,17591,8929324728,1220,640,480,was the lead singer wearing a hat when performing,no,4,DB,65
17599,17599,4302198168,647,640,360,is the man trying to train the dogs,no,2,DB,71
17606,17606,7533973826,536,640,360,was the boy wearing a blue helmet when cycling,yes,4,DB,52
17611,17611,5710270308,954,272,480,is the baby curious in the balls,yes,4,DB,38
17614,17614,3832966100,568,640,480,are there a lot of fish seen in the water,no,9,DB,45
17646,17646,6866325406,791,604,1072,are the 3 girls dancing happily,yes,10,DB,68
17649,17649,4196992672,1290,480,640,is the kid proficient in playing guitar,no,1,DB,68
17653,17653,7686790894,825,640,480,is the toy car remotecontrolled,yes,1,DB,64
17660,17660,5311367704,700,640,480,is boy enjoying watching man emptying the pumpkin,yes,4,DB,68
17677,17677,6591879935,1783,640,480,are the two children curious about the guitar,yes,4,DB,65
17685,17685,5433732542,2611,640,360,is this a formal event,no,0,DB,16
17700,17700,8718633296,1812,640,360,is the man having an interview,yes,4,DB,16
17702,17702,2435128613,1237,500,375,are the bears playing or fighting with each other,playing,0,DB,72
17715,17715,2880377389,1033,500,375,are the guys surrounded by short or tall trees,tall,4,DB,39
17726,17726,4342755654,2062,320,240,did the girl look unhappy and angry at the boy when he snatched her hat,yes,3,DB,68
17730,17730,6764437013,678,640,360,are the man and the lady having a fun or serious talk,serious,3,DB,23
17734,17734,3321248752,1035,640,480,is the baby enjoying playing with the toys,yes,3,DB,7
17739,17739,3381196806,1776,640,424,are the people in the living room enjoying themselves with each others company,yes,3,DB,27
17744,17744,3968449268,1455,640,480,is the guy in blue skilled in clay shaping,yes,0,DB,58
17769,17769,7796070742,1441,640,362,is this a formal or casual event,formal,2,DB,58
17773,17773,4407186551,2250,640,480,are the girls exercising or dancing in the beginning,exercising,1,DB,27
17794,17794,12882038053,861,640,1138,is the baby bored or entertained by the man,entertained,5,DB,25
17813,17813,5779635831,1101,640,358,is the man proficient in riding horse,yes,0,DB,67
17837,17837,2729135977,2697,640,480,is the baby able to hold a meaningful conversation at this age,no,5,DB,38
17842,17842,4983163710,2006,640,480,are the people trying to have a drink at the table,yes,2,DB,77
17852,17852,7122184611,1459,640,360,is the two ladies singing in front the main vocalists,yes,3,DB,65
17868,17868,5813640746,1017,640,480,is the cat oblivious to the kitten s actions,yes,3,DB,1
17901,17901,7576372286,909,640,480,is the baby entertained or bored by the toy and mic,entertained,3,DB,68
17926,17926,8260718865,1230,640,480,is the band performing or practising,performing,2,DB,65
17927,17927,3326899385,840,640,480,does the girl hold on to the baby the entire time they are watching something,yes,8,DB,68
17944,17944,11633816836,1763,512,384,is the area shown in the video bustling with activity,no,9,DB,29
17975,17975,2421155907,845,500,375,are the chickens walking the same path,no,2,DB,50
17985,17985,5542298519,2100,640,360,are these pet animals,no,1,DB,66
17994,17994,11584732354,2430,640,360,is the dog wild or domesticated,domesticated,0,DB,71
17997,17997,2407008208,1346,640,480,do they look professional,yes,8,DB,45
18004,18004,12418210763,955,640,360,is the man in the blue canoe going in the same direction as the man in the red canoe,no,5,DB,61
18023,18023,5717610831,1368,640,480,is the kid enjoying while dancing,yes,2,DB,55
18025,18025,8174115703,915,272,480,is the man enjoying playing with the baby,yes,4,DB,27
18034,18034,4697144611,1836,640,480,are the boys having fun fighting each other with the sword and red styrofoam,yes,5,DB,27
18037,18037,6225185844,1350,640,480,is the woman wearing spectacles the entire time she is playing the ukulele,yes,4,DB,38
18047,18047,4078377816,773,640,480,is the man having an interview,yes,3,DB,52
18080,18080,7445617208,2697,640,360,are the people performing passionately,yes,0,DB,77
18089,18089,5785351331,1237,480,360,is the girl in striped jacket doing a show and tell,yes,3,DB,68
18095,18095,6043147104,1993,640,480,was the baby wearing socks while lying down,yes,5,DB,38
18108,18108,3760748296,1395,640,480,is the human trying to feed the hamster when he raised his hand in front of the hamster,yes,1,DB,20
18125,18125,6995238668,1969,640,360,is this a time-lapse video,yes,2,DB,52
18175,18175,3841894188,960,640,480,is the dog trying to take the ball with its mouth,yes,2,DB,71
18184,18184,2776980258,1631,500,375,is this a dangerous activity,no,9,DB,5
18186,18186,5296198015,2697,640,480,are there paintings in the corridor,yes,8,DB,16
18198,18198,2898351996,533,640,480,did the jeep get pushed out successfully,yes,5,DB,52
18207,18207,2680420943,1077,640,480,is the dancer proficient in dancing,no,8,DB,77
18208,18208,4823372280,1012,640,480,are the two dancers proficient in dancing,yes,4,DB,62
18233,18233,7966428674,881,640,480,did the bird move around fast for food,no,7,DB,33
18244,18244,2927552798,780,500,375,is the man in white feeling embarrassed when joining the man in black in dancing,yes,4,DB,27
18247,18247,5793991791,1333,640,480,are the kids playing in the safe place,yes,3,DB,68
18256,18256,8356293248,2697,640,360,is the baby hungry for the food when the woman held him,no,2,DB,38
18265,18265,5689183923,1235,640,360,is the cat wild or domesticated,wild,0,DB,1
18283,18283,5352412169,889,640,360,are the three men just playing with each other,yes,2,DB,31
18287,18287,6913450810,587,640,1138,are the kids professional in dancing or practicing,practicing,3,DB,68
18295,18295,4156351891,1815,640,480,does the black cat remain in the box the entire time the white cat was circling the box,yes,6,DB,1
18334,18334,7425571114,316,640,360,were the children introducing themselves at the back,yes,4,DB,68
18335,18335,7958865658,2682,640,360,are the cats playing or fighting with each other,fighting,0,DB,1
18369,18369,5033596068,735,640,360,are the kittens active or asleep,asleep,3,DB,1
18380,18380,7501179714,930,640,360,is the man in green leading the camel where to walk,yes,1,DB,60
18420,18420,5019522100,1251,640,360,is the baby resting or sleeping in the cradle,resting,0,DB,38
18458,18458,5581572407,2025,640,360,is this a tourist destination,yes,5,DB,1
18501,18501,2478396375,1050,640,480,did the baby successfully covered the baby with the blanket on her first tries,no,12,DB,38
18517,18517,3249073529,1077,640,480,are the ladies excited to drink the wine in the middle,yes,5,DB,77
18532,18532,2987528447,1134,640,480,did the cat want to eat the food,no,3,DB,25
18533,18533,5441845281,2148,640,360,is the woman performing alone or in a band,band,0,DB,65
18535,18535,6646443655,924,640,426,are the boys and girls having fun dancing,yes,3,DB,77
18539,18539,4893497579,420,640,360,is the kid skilled at cutting food,no,5,DB,68
18541,18541,3935413118,1455,640,362,did the cat enjoy playing with the man,yes,5,DB,1
18546,18546,13486822104,689,640,360,are the birds mating or playing,mating,3,DB,33
18547,18547,7922391300,939,640,360,does the lady brush the dog fast or slowly,slowly,6,DB,71
18562,18562,3326712901,312,640,424,was the man who rode the vehicle wearing a blue jacket,yes,6,DB,40
18569,18569,2678162316,1728,640,480,does the black car seems new or old,new,2,DB,52
18576,18576,5076319274,1678,640,480,was the woman with the dog wearing a pink cap,yes,2,DB,71
18578,18578,4889389323,1118,640,362,did the boy bring unbrella with him while walking on the road,no,9,DB,52
18581,18581,7851322104,1481,320,240,is the boy skilled at playing the piano,yes,0,DB,68
18585,18585,12475322753,1734,640,360,is this activity dangerous,yes,7,DB,39
18613,18613,2894443839,2121,320,240,does the baby look enjoyed in the video,yes,1,DB,38
18619,18619,5241603640,795,640,480,are the boys having fun playing by the fountain,yes,1,DB,68
18625,18625,3427508686,2697,640,480,are the men giving a speech in front of an audience,yes,5,DB,27
18635,18635,7154804054,888,640,360,are the women helping them with the digging in any way,no,10,DB,68
18641,18641,3528043689,2696,640,428,were they moving in a clockwise or anticlockwise direction,clockwise,7,DB,58
18643,18643,4432887858,555,640,480,was the baby wearing a hoodie when trying to sit up,yes,4,DB,38
18647,18647,8777792406,1543,640,360,did the girl use one or both hands to pick up the ball,one,2,DB,27
18648,18648,3855730364,459,640,480,is the dolphin behind copying the one in front of it,yes,8,DB,45
18660,18660,8444144653,714,640,360,were the boy in red and girl in orange late to join the group,yes,4,DB,68
18661,18661,3427508686,2697,640,480,does the man in left try to explain his points by using hand signs,yes,6,DB,27
18663,18663,7211479772,466,640,360,is it empty or crowded area,empty,7,DB,68
18665,18665,2505388529,928,640,480,was the man wearing a blue jacket when touching the dog,yes,1,DB,71
18681,18681,3512034337,721,640,480,were all the windows of the car left open,no,9,DB,52
18691,18691,8726199251,328,640,360,is the beach sparsely or densely populated,sparsely populated,5,DB,68
18707,18707,4861891761,432,640,360,do the two men look experienced in metal works,yes,2,DB,16
18710,18710,3408077386,1517,640,352,was the girl wearing a headband when riding the toy car,yes,9,DB,7
18712,18712,5969859194,1368,640,360,is the boy in black and the girl in pink puching each other,yes,4,DB,68
18714,18714,2910384458,1078,500,375,is it dangerous to canoe down a waterfall,yes,4,DB,61
18772,18772,8595715210,981,640,360,are the people all underwater,yes,0,DB,58
18783,18783,3414001879,352,640,360,are the people on the horses proficient at riding horses,yes,2,DB,67
18816,18816,4424452250,1355,640,480,are the audiences engaged in his talk,yes,3,DB,62
18825,18825,8484188496,1927,640,360,were the men s actions similar to each other,yes,3,DB,62
18828,18828,2401243971,520,500,375,are the ducklings owned by someone,no,1,DB,33
18890,18890,5741080503,788,480,360,was the small dog brave enough to go against the big dog,yes,1,DB,71
18902,18902,2995795910,974,640,480,is the cat at home,yes,7,DB,43
18920,18920,6896601567,1212,640,480,are both dogs wearing collars the entire time while they are playing,yes,4,DB,71
18932,18932,3395835582,870,480,640,do the people in this band look comfortable performing together,yes,3,DB,58
18960,18960,6542604141,322,640,360,are the men in a competition or a drill,drill,0,DB,52
18970,18970,13693908355,717,640,360,are they on an outdoor adventure,yes,1,DB,58
18983,18983,8630772610,1605,640,360,is the tigers fighting or just playing at the end of the video,fighting,5,DB,75
18987,18987,2660084453,1100,480,272,does the dog feels frightened when the man in white moves it,yes,2,DB,55
18993,18993,4085220564,2697,640,480,is there a big crowd watching the performance,yes,9,DB,58
18995,18995,5996570774,728,640,360,is the lady in the middle calm or frustrated,calm,3,DB,68
19002,19002,8521113411,454,640,1138,are the two boys speaking together,no,8,DB,68
19005,19005,6884782376,2697,640,480,are the boys curious towards the toys,yes,10,DB,68
19015,19015,5823056008,1080,640,360,are the elderly well equipped to hike in the mountains,yes,4,DB,39
19032,19032,3215327042,1306,640,480,are the people having a formal or informal conversation,formal,4,DB,77
19044,19044,3030663051,810,640,480,are the chickens eating food from the floor,yes,2,DB,36
19050,19050,3479125526,330,640,480,are the children enjoying playing in the bounce house,yes,3,DB,68
19054,19054,8224945887,726,640,360,was the baby wearing a purple shirt when the man played with him,yes,5,DB,68
19071,19071,3511344402,2055,640,480,are both babies playing with the same toys,no,11,DB,38
19085,19085,13925992413,778,640,480,are the ladies professional or amateur dancers,professional,3,DB,58
19098,19098,3336398510,1693,640,480,is the activity that the man is doing a dangerous activity,yes,2,DB,58
19103,19103,4125964792,590,640,480,is the baby good at putting the blocks into the square holder,yes,1,DB,38
19122,19122,4164993093,1033,360,480,was the boy wearing a striped shirt while drinking,yes,8,DB,68
19131,19131,3736610392,903,640,480,is the cage squeeze or spacious area for the hamsters to stay together,squeeze,2,DB,20
19147,19147,4983163710,2006,640,480,is everyone preparing to have dinner,no,1,DB,77
19165,19165,8378416042,668,272,480,are they preparing for something,yes,7,DB,68
19184,19184,2934685860,1164,640,480,is the kid able to walk without assistance,yes,4,DB,52
19190,19190,3397265196,2158,320,240,is the man talking to an audience or just to the people around him,audience,3,DB,58
19209,19209,3457759630,1389,640,480,was the baby wearing a hat while on the floor,no,0,DB,38
19227,19227,4177209443,2697,640,360,is the man enjoying the music he is playing,yes,7,DB,55
19231,19231,9560998032,1284,272,480,is the lady having fun while playing with the girl,yes,3,DB,25
19239,19239,4932801175,666,640,480,is the woman proficient at riding the horse,yes,1,DB,67
19249,19249,4280307962,384,640,480,are the people having fun talking in the video,yes,7,DB,44
19262,19262,5042374898,2199,640,480,is the man skilled at dancing this genre of dance,yes,5,DB,6
19272,19272,4294147314,1971,640,480,did the man look experienced in carrying the baby,yes,4,DB,38
19294,19294,5312674396,388,640,480,is the man an experienced skater,yes,2,DB,22
19306,19306,6990172057,2697,640,360,are the children skilled at climbing the rock,no,5,DB,68
19317,19317,3269139059,2697,640,480,is the family celebrating girl s birthday,yes,4,DB,77
19328,19328,3831844323,560,640,480,are the people enjoying their time spent outdoors,yes,3,DB,49
19334,19334,8308556521,388,604,1072,are there many books behind the girl,yes,5,DB,68
19339,19339,2955860979,1773,500,375,is it difficult for the baby to feed himself,no,4,DB,25
19346,19346,3477693010,1519,640,480,is the baby trying to walk towards the boy,yes,2,DB,77
19347,19347,4132540355,960,640,480,is the crab moving,no,2,DB,54
19361,19361,4494886746,355,640,480,is the kangaroo in the zoo or the wild,zoo,5,DB,74
19367,19367,3606518674,2622,640,480,are the men enjoying while playing the instruments,yes,2,DB,65
19370,19370,5358657883,961,640,480,are the woman in blue and the men wearing white pants wearing their traditional costumes,no,5,DB,68
19376,19376,5434886589,1812,640,1138,is the baby interested or disinterested in reading the book,disinterested,3,DB,38
19387,19387,6447807673,900,640,360,is the boy trying to bury his leg in the sand again,yes,6,DB,68
19392,19392,11081680244,396,640,360,is the baby resting or sleeping,resting,2,DB,68
19398,19398,4164158586,1078,480,360,is the girl in green deaf,yes,14,DB,38
19408,19408,5251212639,2196,640,480,did the dog take any stuffs from the table,no,1,DB,71
19412,19412,7008777887,1627,640,480,is the cameraman skillful in directing the camera robot,yes,3,DB,62
19435,19435,3579366352,2362,640,360,are the two people dancing feeling happy,yes,4,DB,77
19490,19490,3784008616,1889,640,480,is lady trying to teach the baby,yes,3,DB,27
19500,19500,3246498270,2687,640,480,is the baby very engrossed in the bottle,yes,10,DB,38
19513,19513,3891809559,2426,640,480,are they playing the guitars when they are moving their hands up and down,yes,1,DB,65
19516,19516,12133460724,2756,640,360,was the boy in yellow eating the cake,no,9,DB,25
19529,19529,11584732354,2430,640,360,is the dog well trained to go through the obstacles,yes,2,DB,71
19531,19531,7933516656,1080,640,360,are the bears kept in the zoos or in the wild,zoo,4,DB,72
19565,19565,4904173487,1801,640,480,is the dog wild or domesticated,domesticated,1,DB,25
19576,19576,6013498769,2251,640,360,is the lady talking to 1 person only,yes,8,DB,27
19580,19580,3829362320,2697,640,360,is the girl in green the youngest amongst the group of people,yes,1,DB,16
19615,19615,8484188496,1927,640,360,are the men performing or playing in a band,performing,4,DB,62
19632,19632,7149197841,2697,640,360,is the man teaching the kid to swim,yes,2,DB,38
19637,19637,6063505455,367,480,640,is the boy using enough power to mop the floor with one hand,no,7,DB,68
19641,19641,6196496113,2697,640,480,is the dog wild or domesticated,domesticated,3,DB,8
19649,19649,3277631367,719,640,428,are the men trying to showcase a product,yes,4,DB,62
19650,19650,5398268379,873,640,360,are the children happy in the birthday party,yes,5,DB,77
19659,19659,5312870730,1377,640,480,is the shorter guy afraid of the taller guy,no,6,DB,68
19662,19662,10226201426,884,640,1128,is the baby holding the toy to help him walk,yes,2,DB,64
19687,19687,2987528447,1134,640,480,was the baby trying to feed the cat near the end of the video,yes,1,DB,25
19688,19688,2514487814,1262,640,480,is the dog wild or domesticated,domesticated,1,DB,71
19695,19695,3099327773,1948,640,424,was the woman happy,yes,3,DB,68
19726,19726,7975580325,1416,640,360,is it safe for the two people to be climbing up the steep slope,no,4,DB,71
19752,19752,3957553632,1115,640,480,is the people walking on a path or on the vegetation,vegetation,1,DB,58
19760,19760,3192619327,2697,640,480,is the woman wearing grey focus on reading the large card,yes,0,DB,77
19762,19762,5019522100,1251,640,360,does the baby cry,no,8,DB,38
19784,19784,3359783439,1585,320,240,does it look like a safe activity,no,8,DB,61
19799,19799,6610987705,965,272,480,is the boy the only child in the room,yes,4,DB,64
19826,19826,2761806961,1273,478,360,is the man interested in the toy parrot,yes,9,DB,16
19859,19859,3210496292,618,640,480,is the lady learning how to cook,yes,1,DB,32
19860,19860,5695083572,830,640,480,is the parking lot generally empty or full,empty,6,DB,52
19869,19869,7631378506,1181,640,480,is the group of people enjoying on the boat,yes,2,DB,58
19880,19880,5625946896,714,640,362,are the men having some sort of biking contest,yes,3,DB,50
19886,19886,5391529619,962,640,480,are these people giving an interview,yes,3,DB,58
19887,19887,4366402470,794,640,480,did the boy fall off the horse,no,9,DB,67
19894,19894,3396832512,2115,640,480,does the woman want to feed the cat with meat,no,4,DB,16
20004,20004,8698896692,1056,272,480,is the woman in red happy to see the kids play,yes,7,DB,68
20072,20072,2512028142,1071,320,240,are they trying to make some food with the fire,no,1,DB,58
20083,20083,3534805493,900,640,480,is the man recording the boy speaking,yes,2,DB,68
20090,20090,12872499654,1170,640,360,is this a dangerous activity,no,4,DB,50
20102,20102,6674840917,1603,640,480,does the man try to move backwards or forwards at the end of the video,backwards,3,DB,61
20119,20119,3434972730,570,640,480,is this a place in a park,yes,3,DB,23
20126,20126,4229009987,822,640,480,did the girl change her position when she starts pushing the trolley again,yes,10,DB,64
20135,20135,2533421055,556,320,240,are the horses trying to look for food on the ground,yes,3,DB,67
20140,20140,4755578412,945,320,568,did the boy wear eyeglasses while eating,no,6,DB,77
20145,20145,5358341258,1180,640,480,is the ocean floor bare or crowded,bare,1,DB,45
20158,20158,7298018526,603,568,320,is the boy excited about the food on the table,no,3,DB,68
20167,20167,6824723803,870,640,480,did the lady give the animals any food in the end,no,4,DB,66
20191,20191,3483300439,351,480,360,is the man having some serious conversation,yes,1,DB,58
20213,20213,5829288964,443,272,480,was the boy trying to read a book,yes,3,DB,68
20214,20214,5899552167,382,640,360,are these birds domesticated or wild,domesticated,0,DB,33
20223,20223,3947186552,1379,480,360,is the man playing or working on his laptop,working,0,DB,1
20243,20243,11220088276,904,640,360,did the boys take out the paper pieces from the box together,no,7,DB,68
20244,20244,3163206354,1368,640,480,did the boy in black look comfortable sitting beside the girl in pink,no,2,DB,68
20253,20253,3467522019,504,640,480,are the boys enjoying themselves,yes,3,DB,68
20254,20254,2718262890,468,640,480,is the man in black an engaging speaker,yes,4,DB,16
20270,20270,5735210284,1661,640,480,is the man kissing the baby s feet,yes,4,DB,38
20274,20274,5154656564,722,640,360,is the man wearing white shirt drinking water or wine at the end of the video,wine,3,DB,62
20287,20287,3709571335,859,640,480,does the baby look interested or disinterested in the toys,interested,1,DB,38
20298,20298,3517067405,2697,640,480,is the man the star of the performance,yes,0,DB,65
20309,20309,4486495295,481,640,428,does the dog enjoy the treats,yes,5,DB,71
20330,20330,5323579442,1370,640,480,is the girl proficient at playing piano,yes,1,DB,27
20359,20359,10356090554,603,640,360,does the blue shirt woman look focused or distracted while folding clothes,focused,2,DB,68
20369,20369,11848391003,375,640,360,is the girl wearing pink helmet good at riding scooter,no,3,DB,68
20389,20389,2781566727,1268,320,240,is the man in red experienced in moving the oars,no,0,DB,61
20412,20412,2785529380,1378,320,240,was there still food in the collared cat s bowl when it stood to leave,yes,3,DB,1
20418,20418,13008599135,662,640,360,was the boy on the right side of the slide wearing shoes when sliding down,yes,4,DB,68
20426,20426,3277823769,2250,640,480,is the baby able to stand on its own,no,2,DB,38
20437,20437,4438105322,313,640,480,has the canoe ever toppled over,no,4,DB,61
20440,20440,2436501360,1757,640,428,did the woman in blue look focused or distracted when doing her work,focused,2,DB,25
20444,20444,12760412393,1510,640,1138,are the adults sitting on the sofa watching the performance by the two kids,yes,3,DB,68
20453,20453,5909774623,773,320,240,was the guy on the left wearing a hat while watching the screen,yes,0,DB,62
20458,20458,2771561128,356,500,375,are these three siblings,yes,3,DB,68
20489,20489,3470364154,1938,640,480,does someone else come into the video at the end,no,9,DB,55
20490,20490,2571487892,2158,320,240,does the man with a beard continue to play the guitar while singing,yes,3,DB,65
20494,20494,6964377841,2697,640,480,are the two boys twins,yes,3,DB,68
20532,20532,10294103914,1035,640,360,is the man wearing spectacles a chef,yes,0,DB,77
20538,20538,10211516755,1053,640,360,is the girl skilled at feeding herself,no,3,DB,77
20541,20541,6192440191,1108,360,480,is the cat domesticated or wild,domesticated,4,DB,1
20549,20549,3028745389,1194,640,480,does the man move his dog from left to right continuously,yes,9,DB,71
20561,20561,3249160519,979,640,480,does the girl succeed in snatching back the book from boy tn the end,yes,5,DB,27
